{
  "allocated_preflight_receipt": {
    "path": "/projects/hep/fs9/users/scyiu/RAKL-paper2/receipts/v4_3_1/job-3476576/allocated_preflight.json",
    "sha256": "0cfeffad47340e4d412b5f8c0a46a1b48cca84349d4a1d37fb3c08ed042469ca"
  },
  "arm_record_count": 2,
  "claim_boundary": "At most one fresh non-confirmatory V4.3.1 task/seed unit. A pass is receipt-chain authority only, does not reinterpret V4, and does not establish an arm comparison.",
  "created_at_utc": "2026-08-11T20:16:55.443172Z",
  "evaluated_task_seed_unit_count": 1,
  "execution_checkout": {
    "clean": true,
    "head_sha": "242a39348291141d635a752b9e078fabdab011ea",
    "repo_path": "/projects/hep/fs9/users/scyiu/RAKL-paper2/repo",
    "subject_ancestor": true,
    "tree_sha": "a017ff68b86a952f1c4b10e21699942f66eab427"
  },
  "execution_packet": {
    "path": "research/paper2_microtrial_v4_3_1/EXECUTION_PACKET_V4_3_1_20260811.json",
    "sha256": "30d98131de69c71fa6a3b8ee1e1d39ccd21008c93b8ce929683eb4ab5d0fa457"
  },
  "failures": [],
  "output_normalization_policy_id": "PENDULUM_EXACT_JSON_OR_FENCE_PLUS_REGISTERED_ENVELOPE_UNWRAP_V4_3_1",
  "packet_parent_sha": "0ab47a182537dc3842d7ea4ea24e45b92cc5dc8f",
  "parse_valid_arm_count": 2,
  "result_receipt": {
    "path": "/projects/hep/fs9/users/scyiu/RAKL-paper2/runs/v4_3_1/PENDULUM_SEALED_KNOWN_ANSWER_001-seed-17-job-3476576/result_receipt.json",
    "sha256": "97b9a315b891731595d323092c235b2fc141ba1e897afeedb90e723f2eeaffee"
  },
  "run_manifest": {
    "path": "/projects/hep/fs9/users/scyiu/RAKL-paper2/runs/v4_3_1/PENDULUM_SEALED_KNOWN_ANSWER_001-seed-17-job-3476576/run_manifest.json",
    "sha256": "40d376b50fa5b2ef42ca910d2abe0e7ff2808bef339cc36681f3cd1a9c116e23"
  },
  "scheduler_evidence": {
    "path": "/projects/hep/fs9/users/scyiu/RAKL-paper2/receipts/v4_3_1/sacct-3476576.json",
    "root_row": {
      "account": "lu2026-2-51",
      "allocation_nodes": 1,
      "array": {
        "job_id": 0,
        "limits": {
          "max": {
            "running": {
              "tasks": 0
            }
          }
        },
        "task": "",
        "task_id": {
          "infinite": false,
          "number": 0,
          "set": false
        }
      },
      "association": {
        "account": "lu2026-2-51",
        "cluster": "cosmos",
        "id": 40548,
        "partition": "lu48",
        "user": "scyiu"
      },
      "block": "",
      "cluster": "cosmos",
      "comment": {
        "administrator": "",
        "job": "",
        "system": ""
      },
      "constraints": "",
      "container": "",
      "derived_exit_code": {
        "return_code": {
          "infinite": false,
          "number": 0,
          "set": true
        },
        "signal": {
          "id": {
            "infinite": false,
            "number": 0,
            "set": false
          },
          "name": ""
        },
        "status": [
          "SUCCESS"
        ]
      },
      "exit_code": {
        "return_code": {
          "infinite": false,
          "number": 0,
          "set": true
        },
        "signal": {
          "id": {
            "infinite": false,
            "number": 0,
            "set": false
          },
          "name": ""
        },
        "status": [
          "SUCCESS"
        ]
      },
      "extra": "",
      "failed_node": "",
      "flags": [
        "STARTED_ON_SCHEDULE",
        "START_RECEIVED"
      ],
      "group": "hep",
      "het": {
        "job_id": 0,
        "job_offset": {
          "infinite": false,
          "number": 0,
          "set": false
        }
      },
      "hold": false,
      "job_id": 3476576,
      "kill_request_user": "",
      "licenses": "",
      "mcs": {
        "label": ""
      },
      "name": "p2-pend-v431",
      "nodes": "cn141",
      "partition": "lu48",
      "priority": {
        "infinite": false,
        "number": 65082,
        "set": true
      },
      "qos": "normal",
      "required": {
        "CPUs": 8,
        "memory_per_cpu": {
          "infinite": false,
          "number": 0,
          "set": false
        },
        "memory_per_node": {
          "infinite": false,
          "number": 24576,
          "set": true
        }
      },
      "reservation": {
        "id": 0,
        "name": ""
      },
      "script": "",
      "state": {
        "current": [
          "COMPLETED"
        ],
        "reason": "None"
      },
      "steps": [
        {
          "CPU": {
            "governor": "0",
            "requested_frequency": {
              "max": {
                "infinite": false,
                "number": 0,
                "set": true
              },
              "min": {
                "infinite": false,
                "number": 0,
                "set": true
              }
            }
          },
          "exit_code": {
            "return_code": {
              "infinite": false,
              "number": 0,
              "set": true
            },
            "signal": {
              "id": {
                "infinite": false,
                "number": 0,
                "set": false
              },
              "name": ""
            },
            "status": [
              "SUCCESS"
            ]
          },
          "kill_request_user": "",
          "nodes": {
            "count": 1,
            "list": [
              "cn141"
            ],
            "range": "cn141"
          },
          "pid": "",
          "state": [
            "COMPLETED"
          ],
          "statistics": {
            "CPU": {
              "actual_frequency": 4664669284746657792
            },
            "energy": {
              "consumed": {
                "infinite": false,
                "number": 0,
                "set": true
              }
            }
          },
          "step": {
            "id": "3476576.batch",
            "name": "batch"
          },
          "task": {
            "distribution": "Unknown"
          },
          "tasks": {
            "count": 1
          },
          "time": {
            "elapsed": 92,
            "end": {
              "infinite": false,
              "number": 1786479402,
              "set": true
            },
            "start": {
              "infinite": false,
              "number": 1786479310,
              "set": true
            },
            "suspended": 0,
            "system": {
              "microseconds": 876677,
              "seconds": 9
            },
            "total": {
              "microseconds": 1679130,
              "seconds": 507
            },
            "user": {
              "microseconds": 802453,
              "seconds": 498
            }
          },
          "tres": {
            "allocated": [
              {
                "count": 8,
                "id": 1,
                "name": "",
                "type": "cpu"
              },
              {
                "count": 24576,
                "id": 2,
                "name": "",
                "type": "mem"
              },
              {
                "count": 1,
                "id": 4,
                "name": "",
                "type": "node"
              }
            ],
            "consumed": {
              "average": [
                {
                  "count": 0,
                  "id": 3,
                  "name": "",
                  "type": "energy"
                },
                {
                  "count": 1,
                  "id": 6,
                  "name": "disk",
                  "type": "fs"
                }
              ],
              "max": [
                {
                  "count": 0,
                  "id": 3,
                  "name": "",
                  "node": "cn141",
                  "task": 0,
                  "type": "energy"
                },
                {
                  "count": 1,
                  "id": 6,
                  "name": "disk",
                  "node": "cn141",
                  "task": 0,
                  "type": "fs"
                }
              ],
              "min": [
                {
                  "count": 0,
                  "id": 3,
                  "name": "",
                  "node": "cn141",
                  "task": 0,
                  "type": "energy"
                },
                {
                  "count": 1,
                  "id": 6,
                  "name": "disk",
                  "node": "cn141",
                  "task": 0,
                  "type": "fs"
                }
              ],
              "total": [
                {
                  "count": 0,
                  "id": 3,
                  "name": "",
                  "type": "energy"
                },
                {
                  "count": 1,
                  "id": 6,
                  "name": "disk",
                  "type": "fs"
                }
              ]
            },
            "requested": {
              "average": [
                {
                  "count": 508680,
                  "id": 1,
                  "name": "",
                  "type": "cpu"
                },
                {
                  "count": 2609152,
                  "id": 2,
                  "name": "",
                  "type": "mem"
                },
                {
                  "count": 0,
                  "id": 3,
                  "name": "",
                  "type": "energy"
                },
                {
                  "count": 0,
                  "id": 6,
                  "name": "disk",
                  "type": "fs"
                },
                {
                  "count": 4071424,
                  "id": 7,
                  "name": "",
                  "type": "vmem"
                },
                {
                  "count": 6,
                  "id": 8,
                  "name": "",
                  "type": "pages"
                }
              ],
              "max": [
                {